{
  "schema_version": "A16B_progress_ledger_entry_v1",
  "session_id": "night_a16b_fixture",
  "mission_id": "no_progress",
  "mission_hash": "hash_no_progress",
  "started_at": "2026-05-17T00:00:00Z",
  "ended_at": "2026-05-17T00:02:00Z",
  "status": "NO_OP",
  "branch": "",
  "commit_sha": "",
  "files_changed_count": 0,
  "diff_lines": 0,
  "evidence_pack_path": "",
  "external_report_path": "",
  "tests_run": [],
  "tests_passed": false,
  "contract_result": "PASS",
  "prompt_firewall_result": "REPAIR_ONLY",
  "strategic_pulse_decision": "",
  "forward_progress": false,
  "no_progress_reason": "no commit, branch, artifact, or useful evidence",
  "stop_reason": ""
}
